{
  "vendor_id": "makeup_bridal_glow",
  "name": "Bridal Glow — Makeup & Hair Artistry",
  "category": "makeup_artist",
  "location": "Jayanagar, Bengaluru, Karnataka",
  "price_range_inr": {
    "min": 55000,
    "max": 55000
  },
  "price_unit": "package",
  "price_last_verified": null,
  "price_confidence": "high",
  "contact": {
    "phone": "+91 80886 71140",
    "email": "book@bridalglow.example"
  },
  "gst_number": null,
  "rating": 4.7,
  "review_count": 152,
  "red_flags": [],
  "source_file": "makeup_bridal_glow.md",
  "needs_human_review": false,
  "extraction_notes": null
}
