{
  "vendor_id": "decorator_shaan_decor",
  "name": "Shaan Decor",
  "category": "decorator",
  "location": "Sector 35, Chandigarh",
  "price_range_inr": {
    "min": 160000,
    "max": 320000
  },
  "price_unit": "package",
  "price_last_verified": null,
  "price_confidence": "high",
  "contact": {
    "phone": "+91 97800 41267",
    "email": "info@shaandecor.example"
  },
  "gst_number": null,
  "rating": 4.5,
  "review_count": 118,
  "red_flags": [],
  "source_file": "decorator_shaan_decor.md",
  "needs_human_review": false,
  "extraction_notes": null
}
