{
  "vendor_id": "venue_lakeview_resort",
  "name": "Lakeview Resort",
  "category": "venue",
  "location": "Fateh Sagar, Udaipur, Rajasthan",
  "price_range_inr": {
    "min": 950000,
    "max": null
  },
  "price_unit": "per_day",
  "price_last_verified": null,
  "price_confidence": "low",
  "contact": {
    "phone": "+91 94150 60088",
    "email": "weddings@lakeviewudaipur.example"
  },
  "gst_number": null,
  "rating": 4.8,
  "review_count": 118,
  "red_flags": [],
  "source_file": "venue_lakeview_resort.md",
  "needs_human_review": false,
  "extraction_notes": "Open-ended pricing, starts at ₹9,50,000"
}
