{
  "vendor_id": "makeup_kohl_and_kumkum",
  "name": "Kohl & Kumkum — Bridal Makeup Studio",
  "category": "makeup_artist",
  "location": "C-Scheme, Jaipur, Rajasthan",
  "price_range_inr": {
    "min": 60000,
    "max": 60000
  },
  "price_unit": "package",
  "price_last_verified": null,
  "price_confidence": "high",
  "contact": {
    "phone": "+91 98291 80073",
    "email": "hello@kohlandkumkum.example"
  },
  "gst_number": null,
  "rating": 4.6,
  "review_count": 139,
  "red_flags": [],
  "source_file": "makeup_kohl_and_kumkum.md",
  "needs_human_review": false,
  "extraction_notes": null
}
