{
  "vendor_id": "photographer_moments_co",
  "name": "Moments & Co.",
  "category": "photographer",
  "location": "Banjara Hills, Hyderabad",
  "price_range_inr": {
    "min": 115000,
    "max": 115000
  },
  "price_unit": "package",
  "price_last_verified": null,
  "price_confidence": "high",
  "contact": {
    "phone": "+91 90000 33218",
    "email": "info@momentsandco.example"
  },
  "gst_number": null,
  "rating": 4.6,
  "review_count": 159,
  "red_flags": [],
  "source_file": "photographer_moments_co.md",
  "needs_human_review": false,
  "extraction_notes": null
}
